5;Who is the Minister of Defence of Russia?;The defence minister mentioned in the context is Sergei Shoigu.;"The current Minister of Defense of Russia is Sergei Shoigu. He has been serving in this position since November 6, 2012.

However, it's worth noting that in March 2020, President Vladimir Putin appointed General Valery Gerasimov as the Chief of the General Staff and First Deputy Minister of Defense, making him effectively the second-in-command of the Russian military.";"[""2024 in Russia Events May  carrying the Kosmos 2576 satellite is launched from the Plesetsk Cosmodrome in Arkhangelsk Oblast.\nThe Russian Ministry of Defence proposes to unilaterally adjust Russia's maritime border in the Baltic Sea. However, following comments made by Baltic members of NATO, including Finland and Lithuania, the ministry retracts the proposal.\n23 May:\nDeputy Chief of the General Staff Lieutenant-General Vadim Shamarin is arrested on bribery"", '2024 in Russia Events June  Minister Sergey Lavrov warns that French military instructors will be ""legitimate targets"" if they are deployed to Ukraine.\nOleg Khorokhordin resigns as head of the Altai Republic and is replaced by Andrey Turchak.\n5 June:\nForeign Minister Sergey Lavrov announces that Russia will dispatch additional military supplies and instructors to Burkina Faso to help them boost its defense capabilities.\nRussian cosmonaut Oleg Kononenko becomes', '2 January 2024 Russian strikes on Ukraine Reactions Individual states United Kingdom Prime Minister, Rishi Sunak visited Kyiv on 19 November, announcing a further £50m package of defence aid including 125 anti-aircraft guns, radars and anti-drone technology. He also said he would be stepping up humanitarian aid. On 12 December, in the UK Parliament, former Prime Minister, Boris Johnson asked defence minister, Ben Wallace about supplying Ukraine with long range weapons. He', '2023 North Korea–Russia summit Meeting Background  defence minister Sergei Shoigu attended official celebrations of the 70th anniversary of ""Victory Day"" in Pyongyang a month prior. Since its invasion of Ukraine, Russia has faced severe labor shortages, lack of international support and ammunition shortages. There was speculation that the meeting was to centre around the possibility of Russia receiving large amounts of North Korean ammunition stockpiles from', '2024 in Russia Events May  Defence Yuri Kuznetsov is arrested for bribery of over ₽1 million. His charges carry up to 15 years of jail time.\nRussia puts the nuclear capable submarine-launched Bulava intercontinental ballistic missile into service.\n16 May – President Vladimir Putin meets with Chinese President Xi Jinping in Beijing as part of his two-day visit to China.\n17 May – A 76-mm artillery shell dating']";0.3604714870452881;6.228307723999023;12.057769060134888;21.680492162704468
6;Who won 2024 Russian presidential election?;According to the context, Vladimir Putin won the 2024 Russian presidential election with 87.28% of all votes cast (including invalid ballots), receiving a total of 76,277,708 votes or 88.48%.;"I don't have any information about the outcome of a 2024 Russian presidential election. The information I can access is current up to 01 March 2023, and there's no available data on such an event.

For more recent or updated information, please check with reliable news sources or official announcements from relevant authorities.";"['2024 Russian presidential election Results   On 21 March, the CEC officially announced that Vladimir Putin had won the election, receiving 87.28% of all votes cast (including invalid ballots), followed by Nikolai Kharitonov with 4.31% of the vote, Vladislav Davankov with 3.85% and Leonid Slutsky with 3.20%.', 'Vladimir Putin 2024 presidential campaign Results   Putin won the elections with 76,277,708 votes or 88.48%.', '2024 Russian presidential election Candidates   The individuals below appeared on the ballot.', '2024 Russian presidential election Opinion polls Exit polling  Exit polls on 17 March released by the Russian Public Opinion Research Center showed Vladimir Putin with 87% of the vote, 10% more than in 2018, Nikolai Kharitonov with 4.6%, Vladislav Davankov with 4.2% and Leonid Slutsky with 3%. Invalid ballots accounted for 1.2% of votes cast.', '2024 Russian presidential election Reactions International  Putin.""\nLeaders of countries with neutral or friendly relations with Russia sent congratulations to Putin on his victory, along with President of Republika Srpska Milorad Dodik, members of the Moldovan opposition, and Hamas political chairman Ismail Haniyeh. Presidents Aslan Bzhania and Alan Gagloev, of the pro-Russian breakaway states of Abkhazia and South Ossetia respectively, also congratulated Putin.']";0.7056901454925537;5.030099868774414;17.605888605117798;19.246829748153687
7;Who won 2024 USA presidential election?;The context provided does not mention the results of the 2024 USA presidential election. It only discusses the 2024 Russian presidential election and Vladimir Putin's victory in that election. I do not have any information about the outcome of the 2024 US Presidential Election based on this context.;"I don't have the ability to predict the future or know information that hasn't yet occurred. The 2024 United States presidential election has not taken place, and I do not have any information on who may win it.

If you're looking for information on past elections or general information about presidential elections in the US, I'd be happy to help with that!";"['Vladimir Putin 2024 presidential campaign Results   Putin won the elections with 76,277,708 votes or 88.48%.', '2024 Russian presidential election Results   On 21 March, the CEC officially announced that Vladimir Putin had won the election, receiving 87.28% of all votes cast (including invalid ballots), followed by Nikolai Kharitonov with 4.31% of the vote, Vladislav Davankov with 3.85% and Leonid Slutsky with 3.20%.', '2024 Russian presidential election Candidates   The individuals below appeared on the ballot.', '2024 Russian presidential election Allegations of fraud Statistical analyses  with likely fraud became the majority in 2024, while earlier the fraction of fraudulent polling stations had been a minority. Overall, Meduza stated that the 2024 presidential election ""was almost certainly the most fraudulent"" in ""modern Russian history"", and that the ""sheer magnitude of fraud eclipses that of 2018"".', '2024 Russian presidential election Reactions International  Putin.""\nLeaders of countries with neutral or friendly relations with Russia sent congratulations to Putin on his victory, along with President of Republika Srpska Milorad Dodik, members of the Moldovan opposition, and Hamas political chairman Ismail Haniyeh. Presidents Aslan Bzhania and Alan Gagloev, of the pro-Russian breakaway states of Abkhazia and South Ossetia respectively, also congratulated Putin.']";0.5596702098846436;5.060608625411987;29.685197830200195;25.600280284881592
